{
  "$schema": "https://json-schema.org/draft/2020-12/schema",
  "$id": "https://janhavipatel25-builds.github.io/cleanr-nyc/tonight.schema.json",
  "title": "Cleanr NYC: tonight.json",
  "description": "The contract between the Python pipeline and the React app. One night, 6 PM to 8 AM, New York time. Extra rules checked in code: each mix adds up to 100, and hours are exactly one real hour apart.",
  "type": "object",
  "additionalProperties": false,
  "required": ["version", "generatedAt", "city", "timezone", "night", "now", "hours", "meta"],
  "properties": {
    "version": { "const": 1 },
    "generatedAt": { "$ref": "#/$defs/time", "description": "When the pipeline ran." },
    "city": { "type": "string", "minLength": 1 },
    "timezone": { "type": "string", "minLength": 1 },
    "night": {
      "type": "object",
      "additionalProperties": false,
      "required": ["start", "end"],
      "properties": {
        "start": { "$ref": "#/$defs/time" },
        "end": { "$ref": "#/$defs/time" }
      }
    },
    "now": {
      "description": "The latest actual hour. Used for 'Powering New York now', even before 6 PM.",
      "type": "object",
      "additionalProperties": false,
      "required": ["time", "intensity", "mix"],
      "properties": {
        "time": { "$ref": "#/$defs/time" },
        "intensity": { "$ref": "#/$defs/intensity" },
        "mix": { "$ref": "#/$defs/mix" }
      }
    },
    "hours": {
      "description": "One entry per hour, 6 PM to 8 AM. 15 normally; 14 or 16 on daylight-saving nights.",
      "type": "array",
      "minItems": 14,
      "maxItems": 16,
      "items": { "$ref": "#/$defs/hour" }
    },
    "meta": {
      "type": "object",
      "additionalProperties": false,
      "required": ["dataThrough", "thresholds", "forecastMethod", "emissionFactors", "sources"],
      "properties": {
        "dataThrough": { "$ref": "#/$defs/time", "description": "Time of the latest NYISO reading used." },
        "thresholds": {
          "type": "object",
          "additionalProperties": false,
          "required": ["p33", "p67"],
          "properties": {
            "p33": { "type": "number" },
            "p67": { "type": "number" }
          }
        },
        "forecastMethod": { "type": "string" },
        "emissionFactors": {
          "type": "object",
          "additionalProperties": false,
          "required": ["source", "gas", "oil"],
          "properties": {
            "source": { "type": "string" },
            "gas": { "type": "number", "exclusiveMinimum": 0 },
            "oil": { "type": "number", "exclusiveMinimum": 0 }
          }
        },
        "sources": { "type": "array", "items": { "type": "string" } }
      }
    }
  },
  "$defs": {
    "time": { "type": "string", "pattern": "^\\d{4}-\\d{2}-\\d{2}T\\d{2}:\\d{2}:\\d{2}(\\.\\d+)?[+-]\\d{2}:\\d{2}$" },
    "intensity": { "type": "integer", "minimum": 0, "maximum": 2000, "description": "g CO2 per kWh" },
    "percent": { "type": "integer", "minimum": 0, "maximum": 100 },
    "mix": {
      "description": "Share of in-state generation, whole percents. Gas includes dual-fuel and oil plants.",
      "type": "object",
      "additionalProperties": false,
      "required": ["nuclear", "hydro", "wind", "otherRenewables", "gas"],
      "properties": {
        "nuclear": { "$ref": "#/$defs/percent" },
        "hydro": { "$ref": "#/$defs/percent" },
        "wind": { "$ref": "#/$defs/percent" },
        "otherRenewables": { "$ref": "#/$defs/percent" },
        "gas": { "$ref": "#/$defs/percent" }
      }
    },
    "hour": {
      "type": "object",
      "additionalProperties": false,
      "required": ["time", "hourOfDay", "intensity", "label", "mix", "source"],
      "properties": {
        "time": { "$ref": "#/$defs/time", "description": "Start of the hour." },
        "hourOfDay": { "type": "integer", "minimum": 0, "maximum": 23 },
        "intensity": { "$ref": "#/$defs/intensity" },
        "label": { "enum": ["calm", "busy", "rush"], "description": "Relative to tonight's hours (thirds)." },
        "mix": { "$ref": "#/$defs/mix" },
        "source": { "enum": ["actual", "forecast"] }
      }
    }
  }
}
